{
  "$schema": "http://json-schema.org/draft-04/schema#",
  "title": "generic_evidence",
  "description": "Generic evidence linking gene/protein to disease: author-curated or computational or both",
  "type": "object",
  "version": "1.2",
  "properties": {
    "allOf": {
      "$ref": "https://raw.githubusercontent.com/CTTV/json_schema/master/src/evidence/root.json"
    },
    "association_score": {},
    "provenance_type": {},
    "is_associated": {},
    "date_asserted": {},
    "evidence_codes": {
      "type": "array",
      "description": "An array of evidence codes",
      "items": {
        "type": "string",
        "enum": [
          "http://purl.obolibrary.org/obo/ECO_0000205",
          "http://purl.obolibrary.org/obo/ECO_0000053"
        ]
      },
      "minItems": 1
    }
  },
  "patternProperties": {
    "^preferred_hyperlink_[1-9]$": {
      "$ref": "https://raw.githubusercontent.com/CTTV/json_schema/master/src/evidence/linkout.json"
    }
  },
  "required": [
    "association_score",
    "provenance_type",
    "is_associated",
    "date_asserted",
    "evidence_codes"
  ],
  "additionalProperties": false
}