{
    "association_score": [
        {
            "type": "pvalue",
            "value": 0.0000418,
            "method": "Moderated t-statistics computed with limma version 3.16.8. Independent filtering performed using genefilter version 1.46.1, with gene variances as filter statistic. p-values adjusted using Benjamini & Hochberg (1995) FDR correction. By default, significant differential expression called if adjusted p <= 0.05."
        }
    ],
    "evidence_codes": [
        "http://purl.obolibrary.org/obo/ECO_0000205"
    ],
    "provenance_type": [
        {
            "type": "database",
            "version": "111111",
            "id": "Expression_Atlas"
        }
    ],
    "date_asserted": "2015-02-16T09:54:13Z",
    "is_associated": true
}